{
  "schema_version": "1.0.0",
  "snapshot": {
    "source": "wordpress_public_rest_api",
    "source_url": "https://hybridmind.online/wp-json/wp/v2/posts",
    "captured_at": "2026-10-26T13:50:42.469Z",
    "coverage_complete": false,
    "page_count": 0,
    "published_total": 8,
    "note": "Eight explicitly public full-body snapshots: five retained from 2026-10-25 and three captured 2026-10-26. Not a complete inventory. New topic order and difficulty are editorial proposals."
  },
  "articles": [
    {
      "article_id": "hm:article:2494",
      "wp_post_id": 2494,
      "article_revision": "2026-10-18T21:04:33.000Z",
      "canonical_url": "https://hybridmind.online/2026/10/18/agent-approval-gate-action-fingerprint/",
      "title": "Approval Gate: ผูกการอนุมัติกับ Action ที่แน่นอนก่อนเรียก Tool",
      "summary": "ออกแบบ approval gate ให้ receipt ผูกกับ action snapshot ตรวจการเปลี่ยนแปลง หมดอายุ และ replay ด้วยตัวอย่าง Python mock ที่ไม่เรียก publisher จริง",
      "locale": "th",
      "status": "published",
      "password_protected": false,
      "visibility": "public",
      "published_at": "2026-10-18T06:18:32.000Z",
      "modified_at": "2026-10-18T21:04:33.000Z",
      "topic_ids": [],
      "primary_topic_id": null,
      "content_type": "unknown",
      "audience_level": "unknown",
      "content_state": "review_needed",
      "source_hash": "49029c928f54c86d79bb8f579aed060794a03170f9d7c31128f59dd2563fe80d",
      "schema_version": "1.0.0"
    },
    {
      "article_id": "hm:article:2310",
      "wp_post_id": 2310,
      "article_revision": "2026-10-18T21:04:45.000Z",
      "canonical_url": "https://hybridmind.online/2026/10/16/rag-document-authorization-before-hydration/",
      "title": "RAG ค้นเจอแล้ว อ่านได้ไหม? ตรวจสิทธิ์เอกสารก่อนส่งให้โมเดล",
      "summary": "ออกแบบ authorization gate สำหรับ RAG โดยตรวจ tenant และสิทธิ์รายเอกสารก่อนโหลดข้อความ ส่งให้ reranker หรือสร้าง context พร้อมตัวอย่าง mock ที่ปฏิเสธโดยปริยายเมื่อไม่มี policy",
      "locale": "th",
      "status": "published",
      "password_protected": false,
      "visibility": "public",
      "published_at": "2026-10-16T10:35:55.000Z",
      "modified_at": "2026-10-18T21:04:45.000Z",
      "topic_ids": [],
      "primary_topic_id": null,
      "content_type": "unknown",
      "audience_level": "unknown",
      "content_state": "review_needed",
      "source_hash": "819c59704b0efee0105745e92a5b2300632112ec1f8b478ac0c5ccf0fbef7d6a",
      "schema_version": "1.0.0"
    },
    {
      "article_id": "hm:article:2241",
      "wp_post_id": 2241,
      "article_revision": "2026-10-18T21:05:05.000Z",
      "canonical_url": "https://hybridmind.online/2026/10/16/rag-citation-gate-current-revision-sha256-utf8-byte-span/",
      "title": "RAG อ้างเอกสารเก่า? ตรวจ Citation ให้ตรงรุ่นด้วย SHA-256 และ UTF-8",
      "summary": "สร้าง gate ตรวจ citation สำหรับ RAG ด้วย Python: ให้ manifest ฝั่งแอปกำหนด revision ปัจจุบัน ตรวจ SHA-256 และ UTF-8 byte span พร้อมปฏิเสธ quote จากเอกสารฉบับเก่าโดยไม่อ้างว่าพิสูจน์ความจริงของคำตอบ",
      "locale": "th",
      "status": "published",
      "password_protected": false,
      "visibility": "public",
      "published_at": "2026-10-16T08:01:34.000Z",
      "modified_at": "2026-10-18T21:05:05.000Z",
      "topic_ids": [],
      "primary_topic_id": null,
      "content_type": "unknown",
      "audience_level": "unknown",
      "content_state": "review_needed",
      "source_hash": "101dff6b44b53b804559fb1cdd260783beb713eebcd5d49b8130b7f313e050be",
      "schema_version": "1.0.0"
    },
    {
      "article_id": "hm:article:1077",
      "wp_post_id": 1077,
      "article_revision": "2026-10-14T02:14:19.000Z",
      "canonical_url": "https://hybridmind.online/2026/10/13/verify-ai-answers-facts-numbers-citations/",
      "title": "ตรวจสอบคำตอบ AI: เช็กข้อเท็จจริง ตัวเลข และอ้างอิงปลอม",
      "summary": "วิธีตรวจสอบคำตอบ AI แบบทีละข้อ เช็กแหล่งอ้างอิง ตัวเลข หน่วย และวันที่ พร้อมใบตรวจใช้ซ้ำและแบบฝึกเปิดเฉลย 3 กรณีสำหรับคนไม่เขียนโค้ด",
      "locale": "th",
      "status": "published",
      "password_protected": false,
      "visibility": "public",
      "published_at": "2026-10-13T02:57:42.000Z",
      "modified_at": "2026-10-14T02:14:19.000Z",
      "topic_ids": [],
      "primary_topic_id": null,
      "content_type": "unknown",
      "audience_level": "unknown",
      "content_state": "review_needed",
      "source_hash": "76cb61bf61f10560a2b4518692f62ea72fbb884a0da454a18db49c8047db61bd",
      "schema_version": "1.0.0"
    },
    {
      "article_id": "hm:article:1073",
      "wp_post_id": 1073,
      "article_revision": "2026-10-13T07:36:30.000Z",
      "canonical_url": "https://hybridmind.online/2026/10/13/verify-ai-generated-code-tests-thai/",
      "title": "ตรวจโค้ดที่ AI เขียนอย่างไร: จับบั๊กด้วย 8 Tests ก่อนใช้งานจริง",
      "summary": "คู่มือตรวจโค้ดที่ AI เขียน พร้อม Python ที่ลองรันได้ 8 Tests จับบั๊กขอบเขต ตรวจเฉลยผิด และเช็กลิสต์ก่อนรับงานจริง",
      "locale": "th",
      "status": "published",
      "password_protected": false,
      "visibility": "public",
      "published_at": "2026-10-13T02:56:19.000Z",
      "modified_at": "2026-10-13T07:36:30.000Z",
      "topic_ids": [],
      "primary_topic_id": null,
      "content_type": "unknown",
      "audience_level": "unknown",
      "content_state": "review_needed",
      "source_hash": "148aab6bc1381decc0897bec20199b767f9532c9a355c2ceff5100d1b44fa3c9",
      "schema_version": "1.0.0"
    },
    {
      "article_id": "hm:article:1740",
      "wp_post_id": 1740,
      "article_revision": "2026-10-19T00:49:20.000Z",
      "canonical_url": "https://hybridmind.online/2026/10/14/ai-agent-retrieval-evaluation-evidence-answer-errors/",
      "title": "Retrieval Evaluation ของ AI Agent: ค้นเจอแล้ว ทำไมยังตอบผิด?",
      "summary": "Retrieval Evaluation ของ AI Agent แยกค้นพลาด บริบทหาย และตอบเกินหลักฐาน เปรียบเทียบ Recall@k, RAGAS, ARES พร้อม Infographic, Interactive และเกมจำลอง",
      "locale": "th",
      "status": "published",
      "password_protected": false,
      "visibility": "public",
      "published_at": "2026-10-14T04:28:16.000Z",
      "modified_at": "2026-10-19T00:49:20.000Z",
      "topic_ids": [],
      "primary_topic_id": null,
      "content_type": "explainer",
      "audience_level": "beginner",
      "content_state": "review_needed",
      "source_hash": "1dcc08498c97ef66151096854735aabcb2708d2a00b27f440a23f86a899e1679",
      "schema_version": "1.0.0"
    },
    {
      "article_id": "hm:article:1755",
      "wp_post_id": 1755,
      "article_revision": "2026-10-19T00:50:54.000Z",
      "canonical_url": "https://hybridmind.online/2026/10/14/ai-agent-evidence-sufficiency-multi-hop-proof-sets/",
      "title": "Evidence Sufficiency ของ AI Agent: ค้นเจอหลายชิ้น แต่หลักฐานพอให้ตอบหรือยัง?",
      "summary": "Evidence Sufficiency ของ AI Agent ตรวจหลักฐานหลายขั้น แยกข้อเชื่อมที่ขาดและชุดหลักฐานทางเลือก พร้อม Architecture, Infographic, Interactive และเกมจำลอง",
      "locale": "th",
      "status": "published",
      "password_protected": false,
      "visibility": "public",
      "published_at": "2026-10-14T05:39:17.000Z",
      "modified_at": "2026-10-19T00:50:54.000Z",
      "topic_ids": [],
      "primary_topic_id": null,
      "content_type": "explainer",
      "audience_level": "intermediate",
      "content_state": "review_needed",
      "source_hash": "8e9e381fd1cac1ba1db472ba7b134e2aec6c20465b88296bd1784297ea85b0c4",
      "schema_version": "1.0.0"
    },
    {
      "article_id": "hm:article:1770",
      "wp_post_id": 1770,
      "article_revision": "2026-10-14T06:43:29.000Z",
      "canonical_url": "https://hybridmind.online/2026/10/14/ai-agent-claim-decomposition-preservation-factual-support/",
      "title": "Claim Decomposition ของ AI Agent: แยกคำตอบอย่างไรไม่ให้สร้างข้ออ้างใหม่",
      "summary": "Claim Decomposition ของ AI Agent แยกการรักษาความหมายต้นฉบับจากการตรวจหลักฐาน เปรียบเทียบ FActScore และ DecompScore พร้อม Infographic, Interactive และเกมจำลอง",
      "locale": "th",
      "status": "published",
      "password_protected": false,
      "visibility": "public",
      "published_at": "2026-10-14T06:43:29.000Z",
      "modified_at": "2026-10-14T06:43:29.000Z",
      "topic_ids": [],
      "primary_topic_id": null,
      "content_type": "explainer",
      "audience_level": "advanced",
      "content_state": "review_needed",
      "source_hash": "52999018856072efb4f790e3b18b2d85efd020c09596a3386f3d7d9d81aebd3b",
      "schema_version": "1.0.0"
    }
  ],
  "sections": [
    {
      "section_id": "hm:section:2494:h-eb8b4ca03e88409c",
      "article_id": "hm:article:2494",
      "heading_text": "ปัญหา: อนุมัติเรื่องหนึ่ง แต่ระบบทำอีกเรื่อง",
      "heading_level": 2,
      "anchor": null,
      "anchor_aliases": [],
      "anchor_status": "missing",
      "summary": null,
      "content_text": null,
      "display_order": 0,
      "article_revision": "2026-10-18T21:04:33.000Z",
      "schema_version": "1.0.0"
    },
    {
      "section_id": "hm:section:2494:h-4f543ff539854889",
      "article_id": "hm:article:2494",
      "heading_text": "ขอบเขตและสมมติฐานที่ต้องพูดให้ชัด",
      "heading_level": 2,
      "anchor": null,
      "anchor_aliases": [],
      "anchor_status": "missing",
      "summary": null,
      "content_text": null,
      "display_order": 1,
      "article_revision": "2026-10-18T21:04:33.000Z",
      "schema_version": "1.0.0"
    },
    {
      "section_id": "hm:section:2494:h-e47f37dfe84f4db7",
      "article_id": "hm:article:2494",
      "heading_text": "การสร้าง fingerprint แบบ schema คงที่",
      "heading_level": 2,
      "anchor": null,
      "anchor_aliases": [],
      "anchor_status": "missing",
      "summary": null,
      "content_text": null,
      "display_order": 2,
      "article_revision": "2026-10-18T21:04:33.000Z",
      "schema_version": "1.0.0"
    },
    {
      "section_id": "hm:section:2494:h-07831ca311ef4e34",
      "article_id": "hm:article:2494",